<!DOCTYPE Organization  SYSTEM 'Organization.dtd'>
<Organization InFile="#INPUT#" OutFile="#OUTPUT#"
	     ModelName="llqq"
	     POINames="mu">
  <Item Name="one[1]"/>

  <Item Name="ATLAS_Jet_Scale1[0, -5, 5]"/>
  <Item Name="nom_ATLAS_Jet_Scale1[0]"/>
  <Item Name="RooGaussian::ATLAS_Jet_Scale1Constraint(ATLAS_Jet_Scale1, nom_ATLAS_Jet_Scale1, 1)"/>

  <Item Name="ATLAS_LargeR_Res1[0, -5, 5]"/>
  <Item Name="nom_ATLAS_LargeR_Res1[0]"/>
  <Item Name="RooGaussian::ATLAS_LargeR_Res1Constraint(ATLAS_LargeR_Res1, nom_ATLAS_LargeR_Res1, 1)"/>

  <Item Name="ATLAS_LargeR_Res2[0, -5, 5]"/>
  <Item Name="nom_ATLAS_LargeR_Res2[0]"/>
  <Item Name="RooGaussian::ATLAS_LargeR_Res2Constraint(ATLAS_LargeR_Res2, nom_ATLAS_LargeR_Res2, 1)"/>
  <!-- PDF -->
  <Item Name="EDIT::NEWPDF(OLDPDF,
	      alpha_ATLAS_JET_GroupedNP_2Constraint=one,
	      alpha_ATLAS_JET_WZ_Run1_pTConstraint=one,
	      alpha_ATLAS_JET_WZ_Run1_massConstraint=one,
	      alpha_ATLAS_JET_WZ_Run1_D2Constraint=one,
	      alpha_ATLAS_FATJET_JERConstraint=one,
	      alpha_ATLAS_FATJET_JMRConstraint=one,
	      alpha_ATLAS_JET_GroupedNP_2=ATLAS_Jet_Scale1,
	      alpha_ATLAS_JET_WZ_Run1_pT=ATLAS_Jet_Scale1,
	      alpha_ATLAS_JET_WZ_Run1_mass=ATLAS_Jet_Scale1,
	      alpha_ATLAS_JET_WZ_Run1_D2=ATLAS_Jet_Scale1,
	      alpha_ATLAS_FATJET_JER=ATLAS_LargeR_Res1,
	      alpha_ATLAS_FATJET_JMR=ATLAS_LargeR_Res2,
	      )"/>
</Organization>
